"id";"Full name";"Email";"Profile url";"First name";"Last name";"Title";"Avatar";"Location";"Address";"Birthday";"Summary";"Twitter";"Phone 1";"Phone 1 type";"Phone 2";"Phone 2 type";"Phone 3";"Phone 3 type";"Messenger 1";"Messenger 1 type";"Messenger 2";"Messenger 2 type";"Messenger 3";"Messenger 3 type";"Website 1";"Website 2";"Website 3";"Organization 1";"Organization Title 1";"Organization Start 1";"Organization End 1";"Organization Description 1";"Organization Location 1";"Organization LI URL 1";"Organization LI ID 1";"Organization WWW 1";"Organization Domain 1";"Organization 2";"Organization Title 2";"Organization Start 2";"Organization End 2";"Organization Description 2";"Organization Location 2";"Organization LI URL 2";"Organization LI ID 2";"Organization WWW 2";"Organization Domain 2";"Organization 3";"Organization Title 3";"Organization Start 3";"Organization End 3";"Organization Description 3";"Organization Location 3";"Organization LI URL 3";"Organization LI ID 3";"Organization WWW 3";"Organization Domain 3";"Organization 4";"Organization Title 4";"Organization Start 4";"Organization End 4";"Organization Description 4";"Organization Location 4";"Organization LI URL 4";"Organization LI ID 4";"Organization WWW 4";"Organization Domain 4";"Organization 5";"Organization Title 5";"Organization Start 5";"Organization End 5";"Organization Description 5";"Organization Location 5";"Organization LI URL 5";"Organization LI ID 5";"Organization WWW 5";"Organization Domain 5";"Organization 6";"Organization Title 6";"Organization Start 6";"Organization End 6";"Organization Description 6";"Organization Location 6";"Organization LI URL 6";"Organization LI ID 6";"Organization WWW 6";"Organization Domain 6";"Organization 7";"Organization Title 7";"Organization Start 7";"Organization End 7";"Organization Description 7";"Organization Location 7";"Organization LI URL 7";"Organization LI ID 7";"Organization WWW 7";"Organization Domain 7";"Education 1";"Education Degree 1";"Education FOS 1";"Education Grade 1";"Education Start 1";"Education End 1";"Education Description 1";"Education 2";"Education Degree 2";"Education FOS 2";"Education Grade 2";"Education Start 2";"Education End 2";"Education Description 2";"Education 3";"Education Degree 3";"Education FOS 3";"Education Grade 3";"Education Start 3";"Education End 3";"Education Description 3";"Skills";"Followers";"Relationship";"Connected at";"Industry";"Mutual Count";"Mutual";"Mutual 1";"Mutual 2";"Interests"
"weienthong";"Wei En THONG";;"https://www.linkedin.com/in/weienthong/";"Wei";"Thong";"Group Governance and Operational Risk Management Intern at Great Eastern";"https://media.licdn.com/dms/image/C5103AQGGqm359R6dlw/profile-displayphoto-shrink_200_200/0?e=1576108800&v=beta&t=yiwGvzBldNO8MKB2yNVyaz_jBhsJGkfMg-0fiKgS4Wc";"Singapore";;"March 8";"If there is one element of myself that I have absolute confidence in, it is my passion for Economics and Finance. I firmly believe that Economics and Finance will continue to play a major role in shaping the future of the world, and I am excited to be part of this rapidly-changing and evolving future.   I like to analyse the world around me. I love being able to utilise my research skills to be able to connect the dots and come up with effective solutions to complex problems.  I like to communicate with people from all walks of life. I love putting myself in the shoes of the people whom I interact with, understanding their concerns, and working towards a meaningful relationship.  Most importantly, I love to learn and serve. There is nothing more exciting to me than being able to improve myself, for the benefit of others, even if improvement comes in the form of baby steps.   With my effective communication skills, strong ability to analyse and passion for lifelong learning, I believe that I can be an asset to any team and work effectively with my colleagues to achieve greater heights together.";;;;;;;;;;;;;;;;;"GREAT EASTERN";"Group Governance and Operational Risk Management Intern";"May 2019";"PRESENT";"Devised new risk culture transformation framework at the firm level and secured approval from Great Eastern Project Steering Committee  Revamped governance and sustainability reporting framework to achieve greater synergy with MAS guidelines on sustainability reporting  Enhanced efficiency of outsourcing risk control processes using self-created VBA programs";"Singapore";"https://www.linkedin.com/company/15626";"15626";;;"Singapore Management University";"Teaching Assistant - International Macroeconomics";"Aug 2018";"Dec 2018";"Improving students' understanding of international macroeconomic theory and building in-depth knowledge of relevant practical applications";"Singapore";"https://www.linkedin.com/company/165981";"165981";;;"UBS";"Group Finance Summer Intern";"May 2018";"Jul 2018";"Upheld strong risk management culture through effective daily product control for FXMM and rates products  Improved time efficiency by generating 50% time savings on MAS risk reporting process";"Singapore";"https://www.linkedin.com/company/1214";"1214";;;"Prudential Assurance Company Singapore";"Financial Consultant";"May 2017";"May 2018";"Helped clients successfully kick-start their financial planning journey in wealth protection and accumulation  Created peace of mind for clients through effective and sincere client onboarding and fi";"Singapore";"https://www.linkedin.com/company/2140469";"2140469";;;"Singapore Management University";"Teaching Assistant - Intermediate Maths for Economics";"Aug 2017";"Nov 2017";"Complemented professor's lectures by conducting weekly consultations for university freshmen students  Built confidence in freshmen towards acing economics core courses";"";"https://www.linkedin.com/company/165981";"165981";;;"International Enterprise Singapore";"Research Assistant";"Jan 2016";"Apr 2016";"Researched key market developments in the North Asia Pacific region (Japan, Korea, Taiwan, Australia)  Formulated significant proposals exploring opportunities for local companies to internat";"Singapore";"https://www.linkedin.com/company/18118";"18118";;;"Singapore Armed Forces Warrant Officer School";"Training Specialist";"Oct 2014";"Dec 2015";"Planned key leadership courses and professional development programmes for SAF Warrant Officers with SAFWOS Directing Staff  Facilitated team building programmes designed to enhance leadership ability of SAF Wa";"Singapore";"https://www.linkedin.com/search/results/index/?keywords=Singapore%20Armed%20Forces%20Warrant%20Officer%20School";;;;"Singapore Management University";"Bachelor of Science - BS";"Economics";"";"2016";"2019";"SMU Scholars' ProgrammeDean's List (Academic Year 16/17, 17/18, 18/19)Current Cumulative GPA: 4.0/4.0SEIC General Secretary and Finance Director";"Hwa Chong Institution";"A Level";"";"";"2008";"2013";"Vice President, HCI Japanese Cultural Club (2012-2013)Deputy Administration Head, HCI National Cadet Corps (2010-2011)Hwa Chong Diploma with Merit";;;;;;;;"""Public Speaking : 9, Market Research : 9, Qualitative Research : 10, Visual Basic for Applications (VBA) : 0, Sales Presentations : 4, Japanese Language Proficiency Test : 7, Research Writing : 5, Persuasive Presentations : 3, Economic Data Analysis : 7, """;"1031";2;;"Financial Services";19;"Daniel Farhan, Kelvin Wong";"Daniel Farhan";"Kelvin Wong";"HSBC; Jeff Weiner; Accenture; UBS; Tony Robbins; Eduardo Saverin"
"amberpoo";"Poo Men Shuen, Amber";;"https://www.linkedin.com/in/amberpoo/";"Poo";"Shuen";"Estate Analyst at Bequest Pte Ltd";"https://media.licdn.com/dms/image/C4E03AQFPcbSj_Bdb9g/profile-displayphoto-shrink_200_200/0?e=1576108800&v=beta&t=wIEfQZ7U11HiLY1XwiPqWjtDB1a9ghxXWp9Sj1oK7ZQ";"Singapore";;;"Known to be a great team player, Amber has voluntarily taken up initiatives of school events and projects as well as develop some business acumen skills through participating in case competitions. She is an earnest and quick learner where she expresses curiosity and interests by inquiring whenever in doubt. She is also an independent and motivated learner where she goes further to attend courses at SGX Academy.   Aside from academic perseverance, Amber also has good communication and people skills by working with external merchants and organisations to successfully organise events such as the school's biannual school bazaar and freshmen camp.  For leisure, she enjoys sweating it out over a round of touch rugby game.";;;;;;;;;;;;;;;;;"GREAT EASTERN";"Life Insurance Specialist";"May 2017";"PRESENT";"";"Singapore";"https://www.linkedin.com/company/15626";"15626";;;"Bequest Pte Ltd";"Estate Analyst";"May 2017";"PRESENT";"";"269a new bridge road";"https://www.linkedin.com/company/3783566";"3783566";;;"Equinix EMEA";"SSC and Project Intern";"Apr 2016";"Dec 2016";"-Reconciled statement of accounts and improved accounts receivable collections -Co-managed an amalgamation project of two legal entities -Analyzed and evaluated customer payments with the use of Oracle 11i and Oracle R12 to help streamline payment requests and achieve higher receivable turnover -Corresponded with a vast profile of customers and mediated invoice discrepancies";"Singapore";"https://www.linkedin.com/company/200342";"200342";;;"Citi";"Temporary Bank Officer at Assets Operations";"Jul 2015";"Sep 2015";"-Pioneered and represented the bank in its Know Your Customer-CIPP to comply with regulatory obligations towards prevention of money laundering and terrorist financing -Achieved target and safeguarded the interests of the bank in retaining customers by working amicably with various sales managers and respective corporate customers";"Singapore";"https://www.linkedin.com/company/11448";"11448";;;"Garden picks Food Manufacturing LLP";"Customer Service cum Administrative Officer";"May 2014";"Aug 2014";"-Managed walk-in and customers over the phone on a daily basis by addressing to queries and/or complaints in a professional conduct to maintain customer loyalty -Negotiated and liaised with external vendors and suppliers when sourcing for products locally and overseas at minimal costs for company’s new campaigns";"";"https://www.linkedin.com/search/results/index/?keywords=Garden%20picks%20Food%20Manufacturing%20LLP";;;;"Singapore Carpentry";"Personal Assistant to Managing Director";"Mar 2013";"Jun 2013";"";"";"https://www.linkedin.com/search/results/index/?keywords=Singapore%20Carpentry";;;;;;;;;;;;;;"Singapore Management University";"Bachelor of Science (Economics)";"Economics";"";"2013";"2017";"";"Jurong Junior College";"'A' Levels";"Science";"";"2011";"2012";"";"Nan Hua High School";"'O' Levels";"";"";"2007";"2010";"";"""Microsoft Office : 11, Microsoft Excel : 10, Management : 10, Event Planning : 4, Social Media : 2, Marketing Communications : 2, Corporate Communications : 2, Financial Services : 2, Estate Planning : 1, Retirement Planning : 0, Life Insurance : 0, Economics : 0, PowerPoint : 7, Microsoft Word : 7, Education Planning : 0, Teamwork : 6, Negotiation : 4, Personal Financial Planning : 0, Preparation of Wills : 0, Lasting Powers of Attorney : 0, Saving for Education : 0, Wealth Preservation Planning : 0, Wealth Preservation : 0, Guardianship : 0, Wills Planning Law : 0, """;"";2;;"Financial Services";19;"Kelvin Wong, Faustina Helena";"Kelvin Wong";"Faustina Helena";"Daniel Goleman; IBM; Ray Dalio; Satya Nadella; Environmental Economics; Harvard Business Review"
"jerome-lim";"Jerome Lim";;"https://www.linkedin.com/in/jerome-lim/";"Jerome";"Lim";"Impacting Life One at a Time";"data:image/gif;base64,R0lGODlhAQABAIAAAAAAAP///yH5BAEAAAAALAAAAAABAAEAAAIBRAA7";"Singapore";;;"In life, we are facing with a lot of uncertainty. My job here is to help my clients to manage the uncertainty and ensure financial stability at the same time.  In short, I am like your financial doctor, we visit a doctor for advise and get use when we are sick. Likewise, I am here to advise my clients on the area of financial and ensure that their dreams/goals are protected.    Do contact me for a session and review on how your dreams/goals can be protected from uncertainty.  Email: JeromeLimJR@rep-sg.greateasternlife.com  Contact: 96949530";;;;;;;;;;;;;;;;;"GREAT EASTERN";"Financial Advisor";"Nov 2016";"PRESENT";"Also as a Life Planner with Calibre Advisory (A Partner of Great Eastern Life), My main objective is to help my clients to do a Financial Risk Management (FRM). I strongly believe that this is the most important parts that every individual will needs. Financial is like a puzzle that comes in many pieces and my job is to help clients to put this pieces together as one and ensure that there isn't any missing piece.";"Singapore";"https://www.linkedin.com/company/15626";"15626";;;"Singapore Chamber of Commerce and Industry / Singapore Business Network";"Committee Member";"Mar 2018";"PRESENT";"";"Singapore";"https://www.linkedin.com/search/results/index/?keywords=Singapore%20Chamber%20of%20Commerce%20and%20Industry%20%2F%20Singapore%20Business%20Network";;;;"J&P Building Systems Pte Ltd";"Product Manager H-BAU Technik";"Jan 2016";"Jun 2016";"Supplier for Waterstop, Formwork for column, Reinforcement Connection Systems, Lifting Anchors and Precast Connection Systems.";"";"https://www.linkedin.com/company/7099552";"7099552";;;"J&P Building Systems Pte Ltd";"Sales Engineer";"Jul 2015";"Dec 2015";"Supplier for building materials for reinforcement system, lifting anchor, formwork for column, connection systems, waterstop and anchor channel.";"Singapore";"https://www.linkedin.com/company/7099552";"7099552";;;"Multico Equipment & Parts Pte Ltd";"Sales Executive";"May 2014";"Jul 2015";"";"Singapore";"https://www.linkedin.com/company/2572584";"2572584";;;"K.U.S Pre-cast Pte Ltd";"Sales Executive";"Jul 2011";"May 2014";"";"Singapore";"https://www.linkedin.com/search/results/index/?keywords=K.U.S%20Pre-cast%20Pte%20Ltd";;;;"VF Fastening Systems Pte Ltd";"Sales Engineer";"Jul 2007";"Jun 2011";"";"Singapore";"https://www.linkedin.com/search/results/index/?keywords=VF%20Fastening%20Systems%20Pte%20Ltd";;;;"Northumbria University";"Bachelor's degree";"Business, Management, Marketing, and Related Support Services";"";"2012";"2013";"";;;;;;;;;;;;;;;"""Financial Risk Management : 5, Money Habitudes : 2, Estate Planning : 2, Business Insurance : 1, Retirement Planning : 1, Employee Benefits Design : 0, Employee Engagement : 0, Personal Insurance : 0, """;"2299";2;;"Financial Services";22;"Zhi Wei Chin, Lawrence Chua";"Zhi Chin";"Lawrence Chua";"Nicholas Fang; The Swift SG; GS E&C; J&P Building Systems Pte Ltd; Northumbria University; GREAT EASTERN"
"amanda-lim-30813254";"Amanda Lim";;"https://www.linkedin.com/in/amanda-lim-30813254/";"Amanda";"Lim";"Manager at Prudential Assurance Company Singapore";"https://media.licdn.com/dms/image/C5103AQF-WbE6q_X9xA/profile-displayphoto-shrink_200_200/0?e=1576108800&v=beta&t=Pvhslk164jnexkeWDQ6Vge-NZl-mN5BZa3N9W_u2nyU";"Singapore";;;"";;;;;;;;;;;;;;;;;"Prudential Assurance Company Singapore";"Corporate Strategy";"Jul 2019";"PRESENT";"";"Singapore";"https://www.linkedin.com/company/2140469";"2140469";;;"Great Eastern Life";"Strategy and Transformation";"Jan 2018";"PRESENT";"";"Singapore";"https://www.linkedin.com/search/results/index/?keywords=Great%20Eastern%20Life%20";;;;"PwC";"Manager";"Jul 2013";"Dec 2017";"Advisory - Transactions (Strategy)";"";"https://www.linkedin.com/company/1044";"1044";;;"PwC";"Senior Associate";"Sep 2011";"Jun 2013";"General Assurance";"";"https://www.linkedin.com/company/1044";"1044";;;"PwC";"Assurance Intern";"May 2010";"Jul 2010";"";"";"https://www.linkedin.com/company/1044";"1044";;;;;;;;;;;;;;;;;;;;;;;"Nanyang Technological University";"Accountancy";"Accounting";"";"2008";"2011";"• Nanyang Scholar";"Universität Mannheim";"";"Accounting";"";"2010";"2010";"";"Victoria Junior College";"";"";"";"2006";"2008";"";"""External Audit : 33, Auditing : 29, Accounting : 27, Financial Accounting : 21, IFRS : 15, US GAAP : 4, Big 4 : 11, """;"";2;;"Financial Services";5;"Jacky Wu, Bernard Foong, ACCA Affiliate, AWP, AEPP";"Acca Affiliate";"Bernard Foong";"Audit/Finance/Accountant Professional; The Walt Disney Company; PwC; Nanyang Technological University Alumni Group; PSIM (Physical Security Information Management) Group; Johnson & Johnson"
"ijeremytang";"Jeremy Tang";;"https://www.linkedin.com/in/ijeremytang/";"Jeremy";"Tang";"Senior Financial Planner at GREAT EASTERN";"data:image/gif;base64,R0lGODlhAQABAIAAAAAAAP///yH5BAEAAAAALAAAAAABAAEAAAIBRAA7";"Singapore";;;"I am passionate to make sure that you and your family achieve the financial and life goals that you desire, as your trusted financial advisor.  I will also ensure that your family continues to move forward with dignity as well as a peace of mind, knowing that all you’ve worked so hard to put together, stays together.  But most importantly, I’ll walk every step of the way with you. Whether it be good times or bad times, not just as your risk manager, but as a friend.  Some of the ways I provide value includes: •Personal  -Risk Management -Income Protection -Retirement Planning -Wealth Accumulation -Wealth Distribution  •General -Motor -Travel -Home  •Corporate -Employees’ Benefit  -Premises Insurance -Public Liability -Work Injury Compensation -Foreign Worker Medical  •Business Continuity -Key-man Protection -Funding of Buy-Sell Agreement -Salary Continuation -Debt Repayment  So let us get together and allow me to make a significant and meaningful impact to you, your family and your business.   If you’re keen on joining me in this meaningful business, you’re more than welcome to contact me for any enquiries on this career.   Contact me via e-mail at jeremytangmg@rep-sg.greateasternlife.com or via my mobile at +6590108467 for any queries and make a friend!";;;;;;;;;;;;;;;;;"GREAT EASTERN";"Senior Financial Planner";"Jul 2019";"PRESENT";"";"Singapore";"https://www.linkedin.com/company/15626";"15626";;;"GREAT EASTERN";"Financial Planner";"Feb 2018";"Jun 2019";"";"";"https://www.linkedin.com/company/15626";"15626";;;"Little Diner";"Service Crew";"Aug 2017";"Feb 2018";"";"Singapore";"https://www.linkedin.com/search/results/index/?keywords=Little%20Diner";;;;"Restaurant ROSSO VINO";"Service Crew";"Aug 2017";"Dec 2017";"";"Singapore";"https://www.linkedin.com/company/7486214";"7486214";;;"Fave";"Brand Ambassador";"Aug 2017";"Oct 2017";"";"";"https://www.linkedin.com/company/6408319";"6408319";;;"Singapore Armed Forces (SAF)";"Assistant Platoon Sergeant";"Jul 2015";"May 2017";"";"North West, Singapore";"https://www.linkedin.com/company/13369341";"13369341";;;"Chevron";"Learning And Development Assistant";"Sep 2014";"Oct 2014";"";"Singapore";"https://www.linkedin.com/company/2192";"2192";;;"SIM Global Education";"Bachelor of Science (Honours)";"Accounting and Finance, University of London";"";"2017";"2020";"";"Ngee Ann Polytechnic";"";"Diploma in Business Studies";"";"2012";"2015";"";"Kent Ridge Secondary School";"";"GCE ‘O’ Levels";"L1R4: 11 - 1(CCA) points";"2008";"2011";"";"""Personal Financial Planning : 9, Life Insurance : 9, Customer Service : 9, Financial Advisory : 4, Retirement Planning : 4, Corporate Finance : 4, Financial Accounting : 4, Social Media : 1, Marketing : 1, Economics : 1, Insurance : 2, Health Insurance : 4, Microsoft Excel : 2, Microsoft PowerPoint : 2, Microsoft Word : 3, Communication : 5, Leadership : 4, Income Protection : 4, """;"622";2;;"Financial Services";16;"Viresh Krishnan, mishu sikka";"Viresh Krishnan";"Mishu Sikka";"TEDx SINGAPORE; GREAT EASTERN; MDRT; Financial Advisor Magazine; Tony Robbins; LIMRA"
"zhiqikwang";"ZhiQi Kwang";;"https://www.linkedin.com/in/zhiqikwang/";"Zhiqi";"Kwang";"Head, Bancassurance Business Development at GREAT EASTERN";"https://media.licdn.com/dms/image/C5103AQHiLMJmwxe2Kg/profile-displayphoto-shrink_200_200/0?e=1576108800&v=beta&t=NCmesmRer-s2QbKXP9F0leUebmgtedSNWZCH7N66DVQ";"Singapore";;"July 1";"I shall not start off by throwing a bunch of compliments of myself like any other human beings with 300 bones. Instead, I am going to tell you how different am I.  I have 301 bones.  That one additional is my funny bone, topped with small dosage of mischief in it. And that is my uncanny sense of humour!";;;;;;;;;;;;;;;;;"GREAT EASTERN";"Head, Bancassurance Business Development";"Aug 2018";"PRESENT";"";"Singapore";"https://www.linkedin.com/company/15626";"15626";;;"United Overseas Bank Limited (UOB)";"Senior Bancassurance Manager";"Feb 2016";"Aug 2018";"Support the Sales and Distribution team in the implementation of the Bank’s strategy to maximize profitability.  Motivate, manage and coach Relationship Managers at a cluster level to drive the bank’s insurance sales with regards to regular premiums (RP), PruLife Vantage Achiever (PLVA) and premium financing.  Coach Relationship Managers at a cluster level to adhere to Bank’s internal policies, business processes and regulatory requirements including complying with the FAA and related Acts.  Conduct Joint field work when necessary with the Relationship Managers.  Review CRM parameters for RP and PLVA for the Relationship Managers to effectively target their customers and convert into sales.  Organize retirement and legacy planning seminar talks for Wealth Banking segment";"";"https://www.linkedin.com/company/6883";"6883";;;"Prudential Assurance Company Singapore";"Wealth Manager";"Jan 2015";"Feb 2016";"Specializes in Vantage series products which targets High Net Worth individuals, analyzing their needs to counsel regarding new financial solutions and update them concerning possible investment opportunities.";"";"https://www.linkedin.com/company/2140469";"2140469";;;"Prudential Assurance Company Singapore";"Executive Financial Consultant";"Jan 2014";"Feb 2016";"I work closely with my clients by assessing their financial situations, providing customized financial advice to grow and preserve their wealth. Addressing their short- and long-term goals such as retirement, education and investment planning and after which, keeping in touch with them frequently to be updated on minor and major changes in their life that will affect their lif";"";"https://www.linkedin.com/company/2140469";"2140469";;;"Prudential Assurance Company Singapore";"Senior Financial Consultant";"Jan 2012";"Dec 2013";"I work closely with my clients by assessing their financial situations, providing customized financial advice to grow and preserve their wealth. Addressing their short- and long-term goals such as retirement, education and investment planning and after which, keeping in touch with them frequently to be updated on minor and major changes in their life that will affect their lif";"";"https://www.linkedin.com/company/2140469";"2140469";;;"Prudential Assurance Company Singapore";"Financial Consultant";"Jul 2010";"Dec 2011";"I work closely with my clients by assessing their financial situations, providing customized financial advice to grow and preserve their wealth. Addressing their short- and long-term goals such as retirement, education and investment planning and after which, keeping in touch with them frequently to be updated on minor and major changes in their life that will affect their lif";"";"https://www.linkedin.com/company/2140469";"2140469";;;;;;;;;;;;;"SIM Global Education";"";"Economics and Finance";"";"2007";"2010";"";;;;;;;;;;;;;;;"""Investments : 13, Microsoft Excel : 12, Insurance : 11, Financial Advisory : 6, Data Analysis : 5, Wealth Management : 5, Health Insurance : 4, Strategic Financial Planning : 4, Risk Management : 3, Employee Benefits : 2, Business Development : 2, Finance : 2, Banking : 2, Life Insurance : 1, Disability Insurance : 1, General Insurance : 1, Retirement Planning : 1, Term Life Insurance : 1, Business Strategy : 1, Financial Services : 1, Commercial Insurance : 1, Microsoft Office : 0, Customer Service : 7, Employee Relations : 1, Management : 1, Critical Illness : 2, Wealth Accumulation : 2, Wealth Preservation Planning : 2, """;"";2;;"Financial Services";7;"Dave Loh AFP,AEPP,IBFQ,IDA, Jian Hui - FINANCIAL ADVISOR";"Dave Loh";"Jian Hui";"United Overseas Bank Limited (UOB); SIMGE (SIM Global Education); Prudential UK; Insurance Professionals; CFA Program Candidates; Monetary Authority of Singapore (MAS)"
