"zareen-angullia-8a1a6338";"Zareen Angullia";;"https://www.linkedin.com/in/zareen-angullia-8a1a6338/";"Zareen";"Angullia";"Director of Partnership Academy, Group Partnership Distribution at AIA Group";"https://media.licdn.com/dms/image/C5603AQE2jBQK_MQnQQ/profile-displayphoto-shrink_200_200/0?e=1576108800&v=beta&t=kWaVSwcUN9ITStMUwMOUAWM2J_DkG8CL7Jlowk4VcM0";"Singapore";;"February 16";"""Accelerate Your Performance!""   A unique blend of 11 years distribution experience in the financial services industry, across multi-channels (Agency, Bancassurance and Brokerage) and multi-disciplines (Sales Management, Training, Retail Bancassurance and Sales Development). This covers both onshore (Singapore) and offshore (Hong Kong, Philippines, China, Indonesia, India, Malaysia, Thailand, Vietnam, Australia, New Zealand, Korea, Sri Lanka, Cambodia).    Zareen is currently Regional Team Lead of Partnership Academy where she leads the learning and development initiatives of Group Partnership Distribution, supporting and delivering business-focused training to all country PD teams and their partners.   She started her financial services career in AIA Singapore where she was a fast growing agent, having accomplished Rising Star in her first year. She was also a Team Manager for a Brokerage specializing in General Insurance, and led a team of 5 successful brokers. After that, she moved on to Bancassurance Sales. After 3 years of selling and on the field coaching in DBS Bank, she found her calling in the corporate world as Training Manager (AXA Life) and now, Regional Team Lead, Partnership Distribution (AIA Group).   Zareen also has a forte in organizing and emcee-ing company events, including regional insurance conventions and other corporate events. She is an ambitious person who is always excited to take on new projects and create innovation, to bring positive change to herself and people around her.   ""Be the change that you want to see in the world"" - Mahatma Gandhi";;;;;;;;;;;;;;;;;"AIA";"Director of Partnership Academy, Group Partnership Distribution";"Jul 2016";"PRESENT";"Team Lead of Group Partnership Academy supporting all learning & development needs for Partnership Distribution";"Singapore";"https://www.linkedin.com/company/406952";"406952";;;"AIA";"Associate Director of Partnership Academy, AIA Group Partnership Distribution";"2015";"PRESENT";"1. Assist the Regional Head of Partnership Academy to develop a professional sales and supervisory function with appropriate levels of compliance through the creation and management of comprehensive Learning and Development programmes covering Knowledge, Attitude, Skills and Habits";"";"https://www.linkedin.com/company/406952";"406952";;;"AXA";"Training Manager, Agency Development Department";"May 2012";"Jul 2015";"- Develop, facilitate & conduct training programs & workshops on Leadership & Sales Development for financial planners and financial services managers - Organize & facilitate events to boost sales and recruitment - Track performance of trainees to ensure they exceed sales targets";"Singapore";"https://www.linkedin.com/company/2221";"2221";;;"DBS Bank";"Bancassurance Specialist";"Jun 2010";"May 2012";"Financial Planning Education Planning Life & Health Insurance Planning Capital Preservation";"";"https://www.linkedin.com/company/163379";"163379";;;"VR SOORIA HOLDINGS PTE. LTD.";"Sales Manager";"Sep 2009";"May 2010";"General Insurance Commercial Insurance Managing Sales Dept";"";"https://www.linkedin.com/company/739760";"739760";;;"AIA";"Financial Service Consultant";"Jan 2007";"Oct 2009";"Financial Planning Life, Health & General Insurance Wealth Preservation & Accumulation";"";"https://www.linkedin.com/company/406952";"406952";;;"Shangri-La Hotels and Resorts";"Guest Relations Executive";"2005";"2007";"Relationship Executive for Business VIPs staying at Horizon Club (Premier rooms)";"Singapore";"https://www.linkedin.com/company/8441";"8441";;;"Ngee Ann Polytechnic";"Diploma";"Mass Communications";"";"2003";"2005";"Graduated with a Diploma in Mass CommunicationDebator & Adjudicator in the Ngee Ann Polytechnic Debate ClubRadio DJ for Radio Heatwave (Campus radio station)Journalist for campus online publication; focusing on music, books, movies & events reviews";"Tanjong Katong Girls' School";"GCE O'Levels";"";"";"1998";"2001";"";;;;;;;;"""Financial Services : 47, Insurance : 47, Management : 40, Strategic Financial Planning : 29, Financial Planning : 29, Risk Management : 28, Health Insurance : 26, General Insurance : 23, Wealth Management : 12, Life Insurance : 11, Sales Management : 10, Change Management : 9, Financial Planners : 6, Portfolio Management : 6, Banking : 6, Marketing Communications : 5, Business Development : 3, Coaching : 20, Team Building : 7, Leadership Development : 7, Training & Development : 5, Team Management : 4, Business Relationship Management : 3, New Business Development : 9, Bancassurance : 3, Sales Trainings : 3, Sales Leadership Training : 3, Relationship Management : 18, """;"";2;;"Financial Services";2;"Isaac Teo and Andrew Yong";"Isaac Teo";"Andrew Yong";"Starbucks; Million Dollar Round Table (Official MDRT Group); Simon Sinek; Jeff Weiner; Google; CNN"
"huei-leeng-june-teoh-b3703154";"Huei Leeng June Teoh";;"https://www.linkedin.com/in/huei-leeng-june-teoh-b3703154/";"Huei";"Teoh";"Lifetime and Financial Coach. Image consultant and Regional Sales Director.";"https://media.licdn.com/dms/image/C5103AQE8EeRmKwg0hw/profile-displayphoto-shrink_200_200/0?e=1576108800&v=beta&t=YNKk8SDCltX0pi4844gqZAUjAPKRtsml07sIMRifugc";"Singapore";;;"-";;;;;;;;;;;;;;;;;"Personal Capital Management - PCM";"Financial Services Associate Director";;;"";"";"https://www.linkedin.com/company/790343";"790343";;;"AIA";"Financial Service Director";"Jan 1991";"PRESENT";"We pride ourselves with consistently delivering hospitable and prompt service to all our clients. Having been servicing our friends, families and businesses over 25 years and counting, we have ammased a diverse portfolio of clients. And if you ask us, the best part of our job is where business relationships turn into lifelong friendships.  The experience with the Gary Tay and June Teoh District is personal yet professional, light-hearted and yet impactful. We will work together with you to find you solutions that are tailored to your financial needs. We strongly believe that planning for YOUR insurance portfolio should be a process that you look forward to.";"Singapore";"https://www.linkedin.com/company/406952";"406952";;;;;;;;;;;;;;;;;;;;;;;;;;;;;;;;;;;;;;;;;;;;;;;;;;;;;;;;;;;;;;;;;;;;;;;;;;"""Investments : 1, Finance : 1, Insurance : 1, Business Development : 1, Risk Management : 0, Management : 1, """;"";2;;"Insurance";19;"Ang Cheng Feng Daryl, Lenco Tan";"Ang Feng Daryl";"Lenco Tan";"AIA; Ian Bremmer; Personal Capital Management - PCM; Mickey Mikitani; The Economist"
"yoan-jenneth-0a959526";"Yoan Jenneth";;"https://www.linkedin.com/in/yoan-jenneth-0a959526/";"Yoan";"Jenneth";"Connecting people";"https://media.licdn.com/dms/image/C5103AQHkDxN-O54rWA/profile-displayphoto-shrink_200_200/0?e=1576108800&v=beta&t=cpGWBZM1RS9fjihABMfXyh_VSVOFI3dtIgWkSypfHSg";"Singapore";;;"";;;;;;;;;;;;;;;;;"—";"—";"Mar 2019";"PRESENT";"";"—";"https://www.linkedin.com/search/results/index/?keywords=%E2%80%94";;;;"AIA";"Financial Service Consultant";"Jun 2017";"PRESENT";"The importance of guiding and advising correctly for people who surround us everyday is crucial in this society. One of the reason and my personal belief that I would want to share is to encourage and enable people achieving healthier, happier and better planned future life.";"Singapore";"https://www.linkedin.com/company/406952";"406952";;;"Yamaha Music Asia Pte Ltd";"Music Educator";"2010";"2016";"Educate children the joy of learning music through listening, singing, playing, reading and creating music together.";"";"https://www.linkedin.com/search/results/index/?keywords=Yamaha%20Music%20Asia%20Pte%20Ltd";;;;"Motivate music school Pte ltd";"Music Teacher";"Apr 2006";"Aug 2010";"Teaching individual piano and music theory lessons to students age 3.5 years old to adults.";"";"https://www.linkedin.com/search/results/index/?keywords=Motivate%20music%20school%20Pte%20ltd%20";;;;;;;;;;;;;;;;;;;;;;;;;;;;;;;;;;"LASALLE College of the Arts";"Diploma in Music";"Music(Composition)";"";"2005";"2008";"Collaborate music compositions with the other departments of students like dance, visual arts and also with film art students. I love joining choir and chamber choir. We took turns to perform and give comments to support and encourage each other to be better each time and learnt from one another. We learnt transcribing, pedagogy, history, orchestration, music and art cultures, music theory on analyzing scores, percussions ensemble, gamelan ensemble, arranging, and composing. I took part in Chingay Parade and school anniversary celebration - performed in percussions ensemble. I was a volunteered treasurer in International Student Club as well. I enjoyed my student life.";"ABRSM";"Diploma in Teaching of Music Instrumentals";"Music Pedagogy";"";"2010";"PRESENT";"Achieving Grade 8 in both music practical and theory was not stopping me from learning and loving music. I grew to love sharing my knowledge to others especially young children. So, I took part in CTABRSM to learn how to teach and see every child is unique, they all learn differently. I achieved Diploma in Teaching Music Instrumentals.";;;;;;;;"""Music Education : 9, Music : 8, Composition : 6, Piano : 5, Music Theory : 5, Sound : 2, Teaching : 4, Finale : 2, """;"";2;;"Financial Services";1;"Renita Dsouza and Dave Loh AFP,AEPP,IBFQ,IDA";"Renita And Dave Loh Afp";;"Broadcast Music, Inc. (BMI); Yamaha Corporation of America; Forbes; Republic Polytechnic; Hilti Group; National Geographic"
"lim-tian-sin-a9ab116b";"Lim Tian Sin";;"https://www.linkedin.com/in/lim-tian-sin-a9ab116b/";"Lim";"Sin";"Full-Time NTU Accountancy and Business Student";"https://media.licdn.com/dms/image/C4E03AQF837faQojULg/profile-displayphoto-shrink_200_200/0?e=1576108800&v=beta&t=cVs1I5YQtZwx8JKXC0m7KuB9BXj7ZzldNM9w1rIYa8E";"Singapore";;"April 1";"Coming from Diploma in Banking and Financial Services background with Gold Medalist under my belt, I am extremely interested in the area of finance with topics ranging from financial planning to alternative investments. I am looking forward to join investment banking industry by constantly upgrading myself in terms of knowledge and soft skills. At the end of day, I want to make a difference in others' lives by providing advices or other means of help in order for them to lead a better life.";;;;;;;;;;;;;;;;;"AIA";"Financial Services Consultant";"Aug 2018";"PRESENT";"Professional Services Rendered - Financial Health Review and Advice - Marketing of Life Insurance, Investment-Linked Products and Accident & Health Plans";"Singapore";"https://www.linkedin.com/company/406952";"406952";;;"BNP Paribas";"Intern";"Sep 2015";"Jun 2016";"Position held: Intern, Commodity Finance Operation Centre - Handled clients’ requests ranging from issuance of letter of credit to settlement of funds - Ensured the entire cycle of trade financing for clients is properly executed while maintaining an excellent relationship";"Singapore";"https://www.linkedin.com/company/1508";"1508";;;"Yamato Transport (S) Pte Ltd";"Administrative Assistant";"Feb 2015";"Mar 2015";"Position held: Temporary Administrative Executive - Attended to customers’ request of printing customized waybills in order for them to use the company’s courier services - Prepared starter kits for new customers which provides detailed instructions on using";"Singapore";"https://www.linkedin.com/company/2618301";"2618301";;;;;;;;;;;;;;;;;;;;;;;;;;;;;;;;;;;;;;;;;;;"Nanyang Technological University";"Bachelor's degree";"Accounting and Business/Management";"";"2018";"2022";"";"Ngee Ann Polytechnic";"Diploma";"Banking and Financial Services (BFS)";"3.98/4.00";"2013";"2016";"";;;;;;;;"""Microsoft Office : 1, Microsoft Excel : 1, Microsoft Word : 1, Equity Trading : 1, Financial Advisory : 1, Microsoft PowerPoint : 1, Bloomberg Terminal : 1, """;"";2;;"Financial Services";5;"Su Nguan PANG, Philip Tan";"Su Nguan";"Philip Tan";"Harvard Business Review; Bloomberg; Ngee Ann Polytechnic; The Wall Street Journal; Nanyang Technological University; AIA"
"joon-hoong-soh-b4697316b";"Joon Hoong Soh";;"https://www.linkedin.com/in/joon-hoong-soh-b4697316b/";"Joon";"Soh";"Life Planner, Bachelor in Management (Business)";"https://media.licdn.com/dms/image/C5103AQFaRbrEaWVArw/profile-displayphoto-shrink_200_200/0?e=1576108800&v=beta&t=SCANv_wes1RKAPdW3Cr4VlYbLOws8KmPUZOJJlfxb1M";"Singapore";;;"A finance and fitness professional who is currently pursuing Bachelor's degree focused in Management from RMIT University. Junior Life Planner with a demonstrated history in partnership with Great Eastern Life.   Completed high school internship program with Chevron Shipping as a Clearance Specialist Assistant and Administrator. I have gained valuable knowledge and experience through working with different nationalities in the same office.  I’m humbled to learn more from the Business Sales and Marketing industry, incorporating quality skills and value add to others professionals.";;;;;;;;;;;;;;;;;"GREAT EASTERN";"Life Planner";"Oct 2018";"PRESENT";"";"";"https://www.linkedin.com/company/15626";"15626";;;"Singapore Armed Forces (SAF)";"Human Resources Executive";"Jul 2016";"Jun 2018";"Welfare Executive to Manpower Officer in HR operations.";"Singapore";"https://www.linkedin.com/company/13369341";"13369341";;;"Chevron";"Internship";"Sep 2013";"Mar 2014";"";"Singapore";"https://www.linkedin.com/company/2192";"2192";;;;;;;;;;;;;;;;;;;;;;;;;;;;;;;;;;;;;;;;;;;"RMIT University";"Bachelor's Degree";"Management";"";"2019";"2020";"";"Singapore Polytechnic";"High School Diploma";"Maritime Studies";"";"2012";"2016";"";;;;;;;;"""Fitness Training : 1, Microsoft Office : 0, Microsoft Excel : 0, Finance : 0, Administrative Assistance : 0, Clerical Skills : 0, Human Resources (HR) : 0, Fitness : 0, Financial Planning : 0, Information Literacy : 0, Risk Management : 0, Research : 0, Swimming : 0, Microsoft Word : 0, Microsoft PowerPoint : 0, Microsoft Outlook : 0, Human Resources Information Systems (HRIS)                              Human Resources Information Systems (HRIS) : 0, Management : 0, Customer Service : 0, Time Management : 0, Team Building : 0, Leadership : 0, Emotional Intelligence : 0, Teamwork : 0, English : 0, Microsoft Applications : 0, HR Operations : 0, Driving : 0, """;"";2;;"Financial Services";1;"Ethan Chua • FINANCIAL PRACTITIONER-ADVISORY";"Ethan Chua";;"Singapore Polytechnic; GREAT EASTERN; United Overseas Bank Limited (UOB); Aviva; DECATHLON FRANCE; RMIT University"
"chan-edwin-5a8a2b49";"Chan Edwin";;"https://www.linkedin.com/in/chan-edwin-5a8a2b49/";"Chan";"Edwin";"Senior Associate Director at Huttons Asia Pte Ltd";"https://media.licdn.com/dms/image/C5103AQFPoV0UR1QDUQ/profile-displayphoto-shrink_200_200/0?e=1576108800&v=beta&t=WYDQAhk_9QgPXJesim61bmKlxVeya5-HOwPnm7Cu97k";"Singapore";;;"";;;;;;;;;;;;;;;;;"Huttons Asia Pte Ltd";"Senior Associate Director";"Mar 2011";"PRESENT";"";"Singapore";"https://www.linkedin.com/company/13626338";"13626338";;;"Great Eastern Life";"Insurance Agent";"Jan 2008";"PRESENT";"";"";"https://www.linkedin.com/company/15626";"15626";;;"Quantum Leap Sg";"Hr Manager";"Feb 2009";"Dec 2012";"";"";"https://www.linkedin.com/search/results/index/?keywords=Quantum%20Leap%20Sg";;;;;;;;;;;;;;;;;;;;;;;;;;;;;;;;;;;;;;;;;;;;;;;;;;;;;;;;;;;;;;;;;"""Financial Advisory : 0, Investments : 0, Strategic Planning : 0, """;"";2;;"Real Estate";1;"David Cheong";"David Cheong";;"SGX; GREAT EASTERN; Huttons Asia Pte Ltd"
"ericcwz";"Eric Chan";;"https://www.linkedin.com/in/ericcwz/";"Eric";"Chan";"Financial Planner";"https://media.licdn.com/dms/image/C5103AQGzlsAnwBk_Vw/profile-displayphoto-shrink_200_200/0?e=1576108800&v=beta&t=gH_avia3jz4GulLPdBcKZjXpPSgOn4utGFhuWAWnv-Q";"Singapore";;;"Upon completion of his National Service, Eric decided to join the Finance Industry, choosing Great Eastern Life because of the family-like culture.   Through his course of learning, Eric picked up many useful and meaningful skills that benefitted himself and others. His hard work paid off when he was awarded Top New Life Planner in July 2018 within his agency.  Eric has since started his undergraduate studies in Bachelor of Business Management with Singapore Management University late August 2018. Though juggling both school and work is not an easy feat, Eric's dedication towards providing the best service for his clients pushes him on.  Upon graduating in year 2022, Eric intends to continue providing financial planning services for his new & future prospects, and at the same time, build and coach a team of professional Financial Planners. With a strong mentorship and supportive team behind Eric, achieving his goals is definitely possible.  Want a significant, meaningful and life-changing experience? Get in touch with Eric today!  Eric Chan Wei Zhang Financial Planner Contact: +65 8100 8521 E-mail: EricChanWZ@rep-sg.greateasternlife.com";;;;;;;;;;;;;;;;;"GREAT EASTERN";"Financial Planner";"May 2018";"PRESENT";"";"Singapore";"https://www.linkedin.com/company/15626";"15626";;;"Singapore Armed Forces (SAF)";"Air Warfare Officer (GBAD)";"Jun 2016";"May 2018";"";"Singapore";"https://www.linkedin.com/company/13369341";"13369341";;;"Panasonic Avionics Services Singapore";"Project Intern";"Sep 2015";"Nov 2015";"";"Singapore";"https://www.linkedin.com/company/14415098";"14415098";;;;;;;;;;;;;;;;;;;;;;;;;;;;;;;;;;;;;;;;;;;"Singapore Management University";"Bachelor of Business Management";"Finance (Wealth Management Track)";"";"2018";"2022";"";"Nanyang Polytechnic";"";"Diploma in Aerospace Systems and Management";"";"2013";"2016";"";;;;;;;;"""Financial Planning : 1, Investment Strategies : 1, Retirement Planning : 1, Life Insurance : 1, Health Insurance : 1, Microsoft Office : 1, C++ : 1, HTML5 : 0, Lightroom : 0, Autodesk Software : 0, Flight Management Systems : 0, """;"";2;;"Financial Services";10;"Ho Lien Yang, Bobo Tan";"Ho Yang";"Bobo Tan";"Nanyang Polytechnic; GREAT EASTERN; Singapore Management University"
"long-bryan-aa9abb31";"long bryan";;"https://www.linkedin.com/in/long-bryan-aa9abb31/";"Long";"Bryan";"NUS Electrical Engineering gradute (Distinction)";"https://media.licdn.com/dms/image/C5603AQHtDp6ZjRADfw/profile-displayphoto-shrink_200_200/0?e=1576108800&v=beta&t=dHHycmY0pMekSnv7WWhqOFQ5NnRUCdREJ0CCjtgPs0I";"Singapore";;;"";;;;;;;;;;;;;;;;;"Great Eastern Life - Advisors Clique";"Financial Consultant";"Jan 2014";"PRESENT";"";"RafflesPlace";"https://www.linkedin.com/company/15626";"15626";;;"Accenture";"Business Analyst";"Jan 2016";"Jul 2016";"";"Raffles City Tower";"https://www.linkedin.com/company/1033";"1033";;;"NUSSU Union Camp 2016/17";"Vice Project Director";"Oct 2015";"Jul 2016";"";"National University of Singapore";"https://www.linkedin.com/search/results/index/?keywords=NUSSU%20Union%20Camp%202016%2F17";;;;"Singapore Armed Forces";"Electronic / Communication Technician";"May 2011";"May 2013";"";"";"https://www.linkedin.com/search/results/index/?keywords=Singapore%20Armed%20Forces";;;;"Resorts World Sentosa";"Finance";"Feb 2011";"Apr 2011";"";"";"https://www.linkedin.com/search/results/index/?keywords=Resorts%20World%20Sentosa";;;;;;;;;;;;;;;;;;;;;;;;"National unviversity of singapore";"Bachelor of Engineering in Electrical Engineering";"";"";"2013";"2017";"";"Anglo-Chinese Junior College'10";"";"";"";"2009";"2010";"";;;;;;;;"""Microsoft Excel : 13, Microsoft Office : 11, Microsoft Word : 8, Social Media : 4, Marketing : 2, Research : 1, AutoCAD : 0, Photoshop : 0, Teamwork : 7, Leadership : 6, Customer Service : 4, Team Leadership : 1, English : 1, """;"";2;;"Financial Services";6;"Jessica Lee, Faustina Helena";"Jessica Lee";"Faustina Helena";"Mobile Apps Marketing & PR; National University of Singapore; Roche d'Amour; Mobile Experts ★ Android ★ iPhone; GREAT EASTERN; Accenture"
"loke-jun-wei-0bb227172";"loke jun wei";;"https://www.linkedin.com/in/loke-jun-wei-0bb227172/";"Loke";"Wei";"Financial Advisor at GREAT EASTERN";"data:image/gif;base64,R0lGODlhAQABAIAAAAAAAP///yH5BAEAAAAALAAAAAABAAEAAAIBRAA7";"Singapore";;;"When people shit at you, throw it into a pot of plant.";;;;;;;;;;;;;;;;;"GREAT EASTERN";"Financial Advisor";"Jun 2018";"PRESENT";"";"";"https://www.linkedin.com/company/15626";"15626";;;"AIBI International Pte. Ltd.";"Ecommerce Specialist";"Jan 2017";"Dec 2017";"";"Singapore";"https://www.linkedin.com/company/10783969";"10783969";;;;;;;;;;;;;;;;;;;;;;;;;;;;;;;;;;;;;;;;;;;;;;;;;;;;;"Singapore University of Social Sciences (SUSS)";"Bachelor's degree";"Business, Management, Marketing, and Related Support Services";"";"2017";"2020";"";;;;;;;;;;;;;;;"""Data Analysis : 0, Business Development : 0, Communication : 0, Business Analysis : 0, Negotiation : 0, """;"";2;;"Financial Services";4;"Rocky Wong, Peter lin Business Strategist";"Rocky Wong";"Peter Business Strategist";"Hays; GREAT EASTERN; J.P. Morgan; Financial Times; Singapore University of Social Sciences (SUSS); Harvard Business Review"
"brandonchoo";"Brandon Choo";;"https://www.linkedin.com/in/brandonchoo/";"Brandon";"Choo";"💼Great Eastern Financial Advisor 🏋🏻‍♂️StrengthNConditioning 🥊Muay Thai Level 2 @ EvolveMMA 🏝SSI Open Water Diver  🎓NTU Sport Science & Management";"https://media.licdn.com/dms/image/C5103AQFBHToZeUw2xA/profile-displayphoto-shrink_200_200/0?e=1576108800&v=beta&t=1k-T8Gc-xhYZI6dJ4Ug78Q8xCaU0UU1P5AC2h5K1TxA";"Singapore";;"May 28";"Connect with me";;;;;;;;;;;;;;;;;"GREAT EASTERN";"Financial Planner";"Jul 2019";"PRESENT";"";"";"https://www.linkedin.com/company/15626";"15626";;;"Evolve MMA";"Operations Intern";"Apr 2016";"Jul 2016";"Evolve Mixed Martial Arts® is Asia's premier championship brand for martial arts. With authentic World Champions in Muay Thai, Brazilian Jiu-Jitsu, Mixed Martial Arts, Boxing, Wrestling, No-Gi Grappling, and more, Evolve MMA is Asia's top martial arts organization.  #1 Martial Arts Organization in Asia (CNN) #1 Instructor Team in Asia (Yahoo! Sports) #1 MMA Gym in Asia (FOX Sports) #1 MMA Gym in Asia (ESPN SportsCenter) #1 Martial Arts School in Asia (Tokyo Times) #1 Mixed Martial Arts Gym in Asia (The Fight Nation) #1 Mixed Martial Arts Camp in Asia (MMA Mania) #1 Fight Team in Asian MMA (Asian MMA) #1 MMA Camp in Asia (Combat Asia) #1 MMA Gym of the Year (Samurai Life) #1 International MMA Gym (Middleeasy)  Evolve MMA aims to provide the best martial arts instruction available anywhere on the planet. Our mission is to unleash greatness in everyone through authentic martial arts under World Champions. Join us!";"Far East Square";"https://www.linkedin.com/company/3305744";"3305744";;;"Times Publishing Limited";"Events Marketing Internship";"2015";"less than a year";"Marshall Cavendish is an international publisher that publishes books, directories, magazines and digital platforms. Our philosophy of enriching life through knowledge transcends boundaries of geography and culture. In line with this vision, our products reach across the globe in 13 languages, and our publishing network spans Asia and the USA.";"Marshall Cavendish";"https://www.linkedin.com/company/698633";"698633";;;"ONE Championship";"Social Media Team";"2013";"2014";"ONE Championship™ is Asia's largest sports media property with a global broadcast to over 1 billion homes across 75 countries.  ONE Championship™ has partnered with FOX and STAR Sports for an unprecedented 10";"";"https://www.linkedin.com/company/3309235";"3309235";;;"Yeo Teck Seng (S) Pte Ltd";"Sales Promoter";"2012";"2014";"At SodaStream each year we provide 1.5 billion liters of home-made soda to millions of homes worldwide, making us one of the largest beverage companies in the world.  We began introducing innovative solutions to the beverage market in 1903 with a syste";"SodaStream";"https://www.linkedin.com/search/results/index/?keywords=Yeo%20Teck%20Seng%20(S)%20Pte%20Ltd";;;;;;;;;;;;;;;;;;;;;;;;"Nanyang Technological University";"Sport Science & Management";"Sport Science & Management";"";"2018";"2022";"The Sport Science & Management (SSM) programme is a robust interdisciplinary degree programme focusing on the scientific principles behind exercise and the human body along with the management of sport organisations.";"Ngee Ann Polytechnic";"Diploma in Business Studies";"Marketing and International Business";"";"2013";"2016";"";;;;;;;;"""Social Media : 3, Athletics : 2, Event Planning : 2, Marketing : 1, Social Media Marketing : 0, Customer Service : 1, Leadership : 0, """;"";2;;"Financial Services";4;"Cherie Tan, AWP, SAMP ™, Ho Lien Yang";"Ho Yang";"Samp";"ONE Championship; Nanyang Technological University; Evolve MMA; Airbnb; Ngee Ann Polytechnic; TED Conferences"
