"samantha-teresa-364961141";"Samantha Teresa";;"https://www.linkedin.com/in/samantha-teresa-364961141/";"Samantha";"Teresa";"Undergraduate at Singapore Management University";"https://media.licdn.com/dms/image/C5103AQGP0fSIzocOXA/profile-displayphoto-shrink_200_200/0?e=1576108800&v=beta&t=zFv7jOCWaNj_pN-X_mNRZH7RBxxWNKaBUIyriZmZ5Mo";"Singapore";;;"";;;;;;;;;;;;;;;;;"Singapore Management University";"Teaching Assistant";"Aug 2019";"PRESENT";"For ECON113 (Economics of Globalization) under Prof. Dr. Bei Hong";"Singapore";"https://www.linkedin.com/company/165981";"165981";;;"AIA";"Financial Consultant";"Aug 2016";"PRESENT";"- Certified by AAJI (Asosiasi Asuransi Jiwa Indonesia) - Million Dollar Round Table in 2017, 2018";"Greater Jakarta Area, Indonesia";"https://www.linkedin.com/company/406952";"406952";;;"Brewin Design Office";"Marketing And Business Development Intern";"May 2019";"Aug 2019";"";"Singapore";"https://www.linkedin.com/company/2981077";"2981077";;;"Singapore Management University";"Teaching Assistant";"Jan 2019";"Apr 2019";"For ACCT002 (Accounting for Entrepreneurs) under Prof. Dr. Yuanto Kusnadi";"Singapore";"https://www.linkedin.com/company/165981";"165981";;;"Terrae Tea Company";"Marketing Intern";"Aug 2018";"Dec 2018";"";"Singapore";"https://www.linkedin.com/search/results/index/?keywords=Terrae%20Tea%20Company";;;;"Singapore Management University";"Research Assistant";"Jun 2018";"Aug 2018";"For a postgraduate student under Prof. Simon Schillebeeckx";"Singapore";"https://www.linkedin.com/company/165981";"165981";;;"OCBC Bank";"Branding & Communications Intern";"Feb 2018";"Jul 2018";"-Assisted the Learning and Development department in maintaining and creating content for Social Media Accounts (Facebook, LinkedIn, etc.) -Managed and produce marketing collaterals -Planned and executed events";"Singapore";"https://www.linkedin.com/company/165277";"165277";;;"Singapore Management University";"Bachelor of Business Administration (Marketing), Cum Laude";"";"";"2017";"2021";"Teaching assistant for the following modules: Accounting for Entrepreneurs, Economics of GlobalizationDistinction in the following modules: Business Law, Business, Government, & Society, Critical Thinking in the Real World, Accounting for Entrepreneurs, Consumer Behaviour, Technology & World Change, Economics of Globalization";"Sekolah Pelita Harapan";"International Baccalaureate Bilingual Diploma";"";"";"2011";"2016";"-Psychology HL-Economics HL-Indonesian A Literature HL-Mathematics SL-Biology SL-English A Language and Literature SL";;;;;;;;"""Social Media : 4, Adobe Photoshop : 2, Publications : 1, Marketing : 0, Microsoft Office : 0, Google Analytics : 0, Leadership : 1, Management : 0, """;"396";2;;"Design";12;"Kevin Kim, Clark Tan";"Kevin Kim";"Clark Tan";"Singapore Management University; OCBC Bank; Brené Brown; Gary Vaynerchuk; Gojek; Google"
"chee-allen-b12a7144";"Chee Allen";;"https://www.linkedin.com/in/chee-allen-b12a7144/";"Chee";"Allen";"Marketing Director at ERA Realty Network Pte Ltd";"https://media.licdn.com/dms/image/C5603AQGX28nCnR-Arg/profile-displayphoto-shrink_200_200/0?e=1576108800&v=beta&t=7Ore2BYachkfJRuHIpqARBeCg4kq-pUZgS6dlj557XY";"Singapore";;;"";;;;;;;;;;;;;;;;;"ERA Realty Network Pte Ltd";"Marketing Director";"Aug 2015";"PRESENT";"";"";"https://www.linkedin.com/company/135330";"135330";;;"PropNex Realty Pte Ltd";"Associate Marketing Manager";"2009";"PRESENT";"";"";"https://www.linkedin.com/company/711620";"711620";;;"AIA";"Financial Services Consultant";"1998";"PRESENT";"";"";"https://www.linkedin.com/company/406952";"406952";;;"Citi";"Assistant Manager (Regonal Cash Process Mgmt)";"1996";"1998";"";"";"https://www.linkedin.com/company/11448";"11448";;;;;;;;;;;;;;;;;;;;;;;;;;;;;;;;;"Singapore Institute of Management";"BSc (Hons) in Mgmt Studies";"Management studies";"";"1993";"1996";"";;;;;;;;;;;;;;;"""Sales : 7, Business Development : 4, Project Management : 4, Microsoft Office : 2, Microsoft Excel : 0, Microsoft Word : 0, PowerPoint : 0, Management : 2, """;"";2;;"Real Estate";1;"shaman osm";"Shaman Osm";;"ERA Realty Network Pte Ltd; HRmatters21; China Luxury Real Estate; Prudential UK; Singapore Property Co-Investors; Singapore investors network"
"caelasim";"Caela Sim";;"https://www.linkedin.com/in/caelasim/";"Caela";"Sim";"Financial Consultant at Advisors Alliance Group (AAG) | Wealth Planning | Risk Management | Corporate Solutions";"data:image/gif;base64,R0lGODlhAQABAIAAAAAAAP///yH5BAEAAAAALAAAAAABAAEAAAIBRAA7";"Singapore";;;"Currently a Financial Consultant at Advisors’ Alliance Group (AAG) as well as a Senior at Singapore Management University (SMU), pursuing a Bachelor of Social Science, majoring in Psychology and Corporate Communications.  At work, I am committed to providing personalised solutions to both my personal and corporate clients. I take pride in being a trusted financial advisor and enjoy building close relationships with my clients. Growing alongside clients & partners from different industries and walks of life gives me great fulfilment. Aside from Financial Advisory, I am also experienced in Business Development, Strategic Partnerships and Corporate Communications through various roles I have held previously.  Off work, I love meeting new people, exploring new spaces, and trying new activities. Enthusiastic, driven and inquisitive, I am always eager to learn new things or skills. Connect with me or email me at caelasim@aiafa.com.sg for any interesting projects, partnerships or for a cup of coffee! ☕️";;;;;;;;;;;;;;;;;"Advisors Alliance Group";"Financial Consultant";"Aug 2018";"PRESENT";"As one of the largest financial services group in Singapore, Advisors Alliance Group (AAG) is well-represented on both the MDRT and IDA platforms. In 2018, AAG received global recognition when it became South-East Asia’s first “100 IDA” financial services group.  As a financial consultant at AAG, my mission is to forge and maintain life-long relationships with my clients to help them improve their long-term financial health and achieve their financial objectives through systematic and strategic approaches.  I specialize in devising and offering customized solutions via diverse tools based on clients’ current financial portfolios, to grow, conserve, protect and distribute their wealth. My specializations include but are not limited to: Corporate Group Insurance Employee Benefits, Estate Planning, Risk Management and Wealth Accumulation.";"Singapore";"https://www.linkedin.com/company/3645393";"3645393";;;"AIA";"Financial Advisor";"Aug 2018";"PRESENT";"";"Singapore";"https://www.linkedin.com/company/406952";"406952";;;"SMU BIZCOM";"Director Of Business Development";"Oct 2017";"Dec 2018";"SMU Bizcom is the Business Development arm of SMU Students' Association (SMUSA), acquiring and liaising with corporate partners to provide discounts, privileges and welfare to the SMU student body.";"";"https://www.linkedin.com/company/14376604";"14376604";;;"Chrysler Communications";"PR Account Coordinator";"May 2018";"Sep 2018";"As a PR Account Coordinator, I was responsible for client media coverage monitoring, providing creative input for client campaign initiatives and PR proposals as well as managing media enquiries on clients’ behalf. I managed all of Chrysler Communications social media platforms (including taking photos, writing posts, searching for trending topics and post scheduling) and pitc";"Singapore";"https://www.linkedin.com/company/1234791";"1234791";;;"Hatchme";"Business Development Intern";"Oct 2016";"Nov 2016";"Hatchme is the first smart job portal in APAC that accurately predicts suitable candidates for each job position with proprietary algorithm that utilizes artificial intelligence to automate the consideration of key indicators to deliver a more efficient job match process while ensuring high suitability and fit between candidates and companies.";"Singapore";"https://www.linkedin.com/company/13242956";"13242956";;;"Wine Connection";"Food and Beverage Captain";"Mar 2015";"Sep 2015";"As a Food and Beverage Caption, my roles required me to provide excellent customer service, make recommendations for wine, food and beverage as well as up-sell and cross-sell products.";"Singapore";"https://www.linkedin.com/company/3617515";"3617515";;;;;;;;;;;;;"Singapore Management University";"Bachelor of Social Science";"Psychology & Corporate Communications";"";"2016";"2019";"Freshman Bash is a highly anticipated school-wide annual event, where Mr & Ms SMU are crowned, celebrating the start of university life for our incoming freshmen. As the Programmes Director of the Freshman Bash, my responsibilities include but were not limited to:•	Planned and organised programmes flow•	Secured judges, emcees and performers•	Worked with all directors to solidify pre-event planning•	Was the point of contact for external parties on event day•	Managed event day operations to ensure smooth programmes flow";"Tampines Junior College";"A Level";"";"";"2013";"2014";"I held various leadership positions during my course of study at TPJC, including:•	ODAC Executive Committee - Alumni & NYAA •	NYAA Camp Commander•	Civics Councillor";"Chung Cheng High School (Main)";"O Levels";"";"";"2009";"2012";"";"""Corporate Insurance : 2, Estate Planning : 2, Financial Planning : 2, Business Development : 4, Event Management : 3, Event Planning : 2, Financial Services : 0, Financial Advisory : 0, Wealth Management : 0, Insurance : 0, General Insurance : 0, Health Insurance : 0, Life Insurance : 0, Commercial Insurance : 0, Retirement Planning : 0, Investment Advisory : 0, Investment Strategies : 0, Business Strategy : 0, Business Planning : 0, Business-to-Business (B2B) : 0, Corporate Communications : 0, Risk Management : 0, Portfolio Management : 0, Asset Management : 0, Asset Allocation : 0, Microsoft Word : 1, Microsoft PowerPoint : 1, Leadership : 5, Communication : 5, Negotiation : 2, Team Leadership : 1, Team Management : 1, Public Speaking : 0, Strategic Partnerships : 0, Internal & External Communications : 1, Wealth Management Services : 0, Wealth Accumulation : 0, Wealth Preservation Planning : 0, Wealth Transfer : 0, Multi-generational wealth transfer : 0, Wealth Preservation : 0, Intergenerational Wealth Transfer : 0, Family Wealth Management : 0, Retirement Solutions : 0, Retirement Savings : 0, Education Savings : 0, B2C : 0, Financial Risk Management : 0, Business Communications : 0, Income Protection : 0, """;"";2;;"Financial Services";39;"Christopher Jong, Chua Inn Chong - E-Commerce Strategist";"Christopher Jong";"Chua Chong - E-Commerce Strategist";"Singapore Management University; Advisors Alliance Group; Chrysler Communications; AIA; Chung Cheng High School (Main); Financial Times"
"malcom-teo-a62669170";"Malcom Teo";;"https://www.linkedin.com/in/malcom-teo-a62669170/";"Malcom";"Teo";"Financial Services Consultant at AIAFA";"https://media.licdn.com/dms/image/C5103AQFPElTZqmrw1w/profile-displayphoto-shrink_200_200/0?e=1576108800&v=beta&t=R9x2OjxTfKEe8kzaxXOY886HVwoeKDpwLCdtd5JfzlM";"Singapore";;;"";;;;;;;;;;;;;;;;;"AIA";"Financial Services Consultant";"Jul 2019";"PRESENT";"Working to pay off my school loans in order to be a much more independent Son. Quality and honesty are my core principals in this business thus I will never compromise on standards. Competent and transparent in both risk and wealth management solutions tailored towards every individual.";"Singapore";"https://www.linkedin.com/company/406952";"406952";;;"Singapore Army";"SAF Commandos";"Jan 2017";"Nov 2018";"SME in Demolition and also a Boatmen in the commandos formation.  Underwent ATEC(Army Training Evaluation Center) in Taiwan during the whole month of April 2018 and clinched the SAF’s best combat unit award with the formation for the 15th Consecu";"";"https://www.linkedin.com/company/3167420";"3167420";;;"Aston’s Singapore";"Service Staff";"Nov 2014";"Dec 2014";"Customer Service from serving food to cashier duties.";"";"https://www.linkedin.com/search/results/index/?keywords=Aston%E2%80%99s%20Singapore";;;;;;;;;;;;;;;;;;;;;;;;;;;;;;;;;;;;;;;;;;;;"National University of Singapore";"Bachelor of Business Administration - BBA";"";"";"2019";"2023";"";"Catholic Junior College";"";"“A Levels” H2 Economics, Mathematics, Chemistry.";"";"2015";"2016";"";"St Joseph's Institution (SJI)";"";"";"";"2011";"2014";"2012 School Hockey Team Member 2012 Chosen to go PSLT(peer support leader training camp) to train to be a servant leader during Orientation Camp towards newly coming secondary 1 students for the school year of 2013.2013-2014 PSF (Peer Support Facilitator) Conducted the PSLTC during Dec 2013  for the newly coming PSLs to train them to be the next batch of servant leaders. Servant Leader towards the PSLs leading the newly inducted secondary 1 students and the secondary 1 students.";"""""";"";2;;"Financial Services";2;"Ho Lien Yang and Henry Chiang";"Ho Yang";"Henry Chiang";"Mickey Mikitani; Ian Bremmer; Deutsche Bank; St Joseph's Institution (SJI); National University of Singapore; AIA"
"zhixian-teo-72643273";"Zhixian Teo";;"https://www.linkedin.com/in/zhixian-teo-72643273/";"Zhixian";"Teo";"Product Specialist, Distribution Marketing";"https://media.licdn.com/dms/image/C5603AQF0OrJNTFljTA/profile-displayphoto-shrink_200_200/0?e=1576108800&v=beta&t=rEvXDa8VHSd3Yb4ycmDKq14gHIAvp30AdOWW92FRQNg";"Singapore";;;"To obtain and grow in a significant and challenging position where the blend of my work experience and prior education can help in achieving the goals of the company. I commit to excel in a progressive organisation where I can contribute and add value in my area of expertise.";;;;;;;;;;;;;;;;;"AIA";"Product Specialist, Distribution Marketing";"Jan 2018";"PRESENT";"- Product specialized training support for targeted districts to drive product sales and ANP growth. - To actively curate presentation training decks to communicate product initiatives and product propositions to the distribution force. - Work alongside the Product team in the development of new products and enhancement of existing products. - Conduct Product Launch trainings and post-launch support activities for the distribution force. - Work with top and mid-tier districts to grow incremental business through campaigns and challenges. - Be proactive to relevant needs and requirement and help distribution force with product enquiries. - Regular communication and support with agency leaders, stakeholders and various departments.";"Singapore";"https://www.linkedin.com/company/406952";"406952";;;"AIA";"Product Synergy Manager, Agency Sales";"Jun 2017";"Dec 2017";"- To develop and implement product mix initiatives for agency cluster to drive key results areas. - Maintain high standards of relationship with agency distribution forces and location Business Development Managers (BDMs) - To build depth in product propositions, to educate and influence sales behaviors of pr";"Singapore";"https://www.linkedin.com/company/406952";"406952";;;"GREAT EASTERN";"Assistant Manager, Product and Sales Training";"Jul 2016";"Jun 2017";"- Conduct product and skills training for all OCBC retail sales staff including Personal Financial Consultants, Financial Protection Specialists, Branch and Premier Relationship Managers as well as on-shore and off-shore Relationship Managers. - Responsible in organising incentive camps / trips for targeted segments of the agency";"Singapore";"https://www.linkedin.com/company/15626";"15626";;;"GREAT EASTERN";"Associate, Product and Sales Training";"Jul 2014";"Jun 2016";"- Co-ordinate and implement monthly motivation meetings for targeted segment reps with the objective of increasing their sales productivity. - Provide a holistic and structured training program in product and sales techniques for the distribution force.";"Singapore";"https://www.linkedin.com/company/15626";"15626";;;"OCBC Bank";"Personal Financial Consultant";"Aug 2013";"Jun 2014";"- Provided financial advisory services to branch customers based on their needs, financial capabilities and risk appetites. - Maintained relationships with customers by providing sound after-sales service. - Attended to customer service related matters on a daily basis at branch level.";"";"https://www.linkedin.com/company/165277";"165277";;;;;;;;;;;;;;;;;;;;;;;"The University of Western Australia";"Bachelor’s Degree";"Corporate Finance & Management";"";"2011";"2013";"International Students Society (ISS)- Assisted in internal events initiatives that would support International Students in Perth to get to know like-minded students from abroad. - Foster interaction between students through a series of activities and events planned by the committee. - Planned campus wide events and prepared publicity posters to increase awareness.";"City University of Hong Kong";"Bachelor’s Degree";"Corporate Finance and Management";"";"2013";"2013";"";"Ngee Ann Polytechnic";"Diploma";"Business Studies";"";"2008";"2011";"School of Business and Accountancy - IDARE Camp Organiser. - Planning of Annual IDARE Leadership Camp. - Taking care of pre-camp, camp day, post-camp and follow up activities. - Selection of capable SF (Student Facilitators) to be responsible for participants during the Camp. - Conducting interviews of participants that would be appropriate candidates for the Camp. - Create awareness and foster shared vision on objectives of IDARE Leadership Camp. - Drawing an action plan in relevance to goals that aim to be achieved.";"""Financial Advisory : 18, Banking : 18, Financial Services : 17, Financial Planning : 8, Financial Analysis : 7, Risk Management : 4, Social Media : 4, Product Management : 1, Training : 12, Management : 5, Insurance Training : 6, """;"";2;;"Insurance";12;"LAY Njin Djoen, YouKeat Chia";"Lay Djoen";"Youkeat Chia";"Aviva; The University of Western Australia; Ngee Ann Polytechnic; GREAT EASTERN; DBS Bank; OCBC Bank"
"bernard-lim-20322972";"Bernard Lim";;"https://www.linkedin.com/in/bernard-lim-20322972/";"Bernard";"Lim";"Associate Director at Professional Investment Advisory Services Pte Ltd";"https://media.licdn.com/dms/image/C5103AQG0NO-Ib6uPkA/profile-displayphoto-shrink_200_200/0?e=1576108800&v=beta&t=QBiQG_7Qfbtg_06jfY-N9O-Yp6VA1mfUQYceypSv0Us";"Singapore";;;"Grooming Professionals Some look for job satisfaction,  financial rewards, some look for career advancement and some still looking for something they like to do. Throughout my years in the industry, I have groom numerous Successful Advisors and Managers.  Take control of your own destiny. With a proven Success formula, give yourself the opportunity to chart your own course in personal achievements and aspirations .I am certain that Through my guidances you will find this is a Rewarding and Satisfying Career !    Changing market and economic conditions are a fact of life, but there are things you can do to help build your wealth, help protect against risk, and help ensure your family's financial security. Understanding your current financial situation, identify gaps, and choose appropriate insurance and financial products is necessary.  My Expertise include:  Legal -Will Writing - Trust   Wealth Protection / Accumulation  -Term -Whole Life -Endowment -Investment-Linked -Accident & Health -Critical Illnesses -Universal Life  Wealth Distribution  -Planning for dependents & third generation -Estate/Wealth preservation  Business Insurance -Buy/Sell agreement -Business succession planning -Employee benefits -Keyman protection  General Insurance -Workman Compensation -Motor Vehicle Insurance -Public Liability  -Fire and Theft insurance -Marine/Cargo";;;;;;;;;;;;;;;;;"Professional Investment Advisory Services Pte Ltd";"Associate Director";"May 2019";"PRESENT";"Recruiting, Training, coaching and Developing Estate planner,Business succession planning";"Suntech";"https://www.linkedin.com/company/1028541";"1028541";;;"AIAFA";"Associate Director";"Oct 2017";"PRESENT";"Recruiter, Trainer, Coach, Estate planning , Business succession planning";"Central Singapore";"https://www.linkedin.com/search/results/index/?keywords=AIAFA";;;;"Self employed";"Associate";"Jul 2014";"PRESENT";"";"Central Singapore";"https://www.linkedin.com/company/406952";"406952";;;"Manulife Financial";"Senior manager";"Mar 2004";"Nov 2013";"Training a team of planners to be specialised in Estate Planning. Working with clients to understand Estate Planning and work out a constructive plan for their wishes how, when, what where and who to give when gone.";"";"https://www.linkedin.com/search/results/index/?keywords=Manulife%20Financial";;;;"AXA life Singapore";"Financial Planner";"Sep 1999";"Mar 2004";"Planning and consultation to client needs and concerns";"";"https://www.linkedin.com/search/results/index/?keywords=AXA%20life%20Singapore";;;;;;;;;;;;;;;;;;;;;;;;"Estate Planning Practitioners Limited";"Assoicate Estate Planning Practitioner";"Estate Planning";"";"2010";"2011";"To understand the complication on  legal issue if one doesn't plan properly to distribute his asset after death, whether is enough to distribute or who, what,when and how.";"ITE bishan";"CBS accounting";"Accounting and Business/Management";"";"1995";"1997";"Accounting and business law";;;;;;;;"""Insurance : 22, Financial Planning : 19, Financial Services : 17, Retirement Planning : 14, Wealth Management : 10, Estate Planning : 6, Investments : 6, Risk Management : 6, Strategic Financial Planning : 4, Portfolio Management : 4, Financial Advisory : 4, Finance : 3, Mutual Funds : 3, Retirement : 3, Life Insurance : 3, Wealth : 3, Asset Management : 2, Investment Advisory : 2, Banking : 2, Retail Banking : 2, Financial Planners : 2, Pensions : 2, Business Strategy : 2, Financial Risk : 1, Employee Benefits Design : 0, Wills : 0, Coaching : 4, Training : 4, Management : 2, Presentation Skills : 0, Money Management : 0, Preparation of Wills : 0, Living Will : 0, Trust Services : 0, Trusted Business Advisor : 0, Workman com : 0, """;"";2;;"Financial Services";14;"Evan Lim, LAY Njin Djoen";"Evan Lim";"Lay Djoen";"Tony Robbins; Bill Gates; AXA; Manulife; MDRT Aspirants; Financial Services Regulation"
