"jae-loh-28982415";"Jae Loh";;"https://www.linkedin.com/in/jae-loh-28982415/";"Jae";"Loh";"Financial Services Manager";"data:image/gif;base64,R0lGODlhAQABAIAAAAAAAP///yH5BAEAAAAALAAAAAABAAEAAAIBRAA7";"Singapore";;;"SP Kinetic";;;;;;;;;;;;;;;;;"AIA";"Financial Services Manager";"Jun 2015";"PRESENT";"";"";"https://www.linkedin.com/company/406952";"406952";;;"AIA";"Senior Financial Services Consultant";"Feb 2010";"PRESENT";"";"";"https://www.linkedin.com/company/406952";"406952";;;"Meltwater News";"Account Manager";"May 2008";"Dec 2009";"";"singapore";"https://www.linkedin.com/company/13277";"13277";;;"Uberture Pte Ltd";"Business Development";"Jan 2005";"Dec 2008";"";"";"https://www.linkedin.com/search/results/index/?keywords=Uberture%20Pte%20Ltd";;;;"ZTE";"Marketing Executive";"2007";"less than a year";"";"China";"https://www.linkedin.com/company/5804";"5804";;;;;;;;;;;;;;;;;;;;;;;"Nanyang Technological University";"Second Upper";"Communication Studies, Advertising, Public Relations, Entreprenuership";"";"2004";"2008";"";;;;;;;;;;;;;;;"""Business Development : 11, Management : 11, Marketing Communications : 6, Account Management : 5, Social Media Marketing : 5, Marketing : 3, Sales : 2, Business Strategy : 2, Marketing Strategy : 2, Public Relations : 2, Digital Marketing : 1, Financial Services : 1, Media Relations : 1, Online Advertising : 1, Social Media : 1, Strategy : 1, """;"";2;;"Financial Services";14;"Lenco Tan, Evan Lim";"Lenco Tan";"Evan Lim";"Mickey Mikitani; AIA; The Wall Street Journal; Nanyang Technological University; Financial Times; Meltwater"
"joseph-lee-812582119";"Joseph Lee";;"https://www.linkedin.com/in/joseph-lee-812582119/";"Joseph";"Lee";"Student at SMU/ Financial Advisor at AIA FA (GT Group)";"https://media.licdn.com/dms/image/C5103AQHaBhnJidRd6g/profile-displayphoto-shrink_200_200/0?e=1576108800&v=beta&t=ZUvNXGkRWnJjfKm9wDIMX9UoxsyxNWEMPZdEb1z9QCk";"Singapore";;;"▪️Top Producer in LIVES (July 2019) ▪️Valedictorian of 2016’s 12th Session in Republic Polytechnic ▪️Interviewed by Shin Min Daily  ▪️Recipient of Lee Foundation Scholarship ▪️Recipient of Republic Award 2016  Despite losing his mother at the age of 6 and having a father whom is a compulsive gambler and an ex-convict, he overcame the adversities in life and rose to the occasion.   He went on to achieve academic excellence in Republic Polytechnic(RP) and pursued Business Management in Singapore Management University (SMU).   Currently a year 2 student in SMU, he is also a financial advisor with AIA FA where he aims to progress his career in the financial advisory industry.";;;;;;;;;;;;;;;;;"AIA";"Financial Advisor";"Feb 2019";"PRESENT";"";"Singapore";"https://www.linkedin.com/company/406952";"406952";;;"Singapore Armed Forces (SAF)";"Training Specialist";"Jan 2017";"May 2018";"- Certified Adventure Learning Instructor - Secretary of Commandant Conference (Jan 2019)";"";"https://www.linkedin.com/company/13369341";"13369341";;;"Deluxe Home Furnishing";"Interior Design Consultant";"Apr 2016";"Jul 2016";"Recommend suitable home solutions and design for clients.  Facilitate the installation of the individual projects.";"Singapore";"https://www.linkedin.com/search/results/index/?keywords=Deluxe%20Home%20Furnishing";;;;"United Overseas Bank Limited (UOB)";"Software Testing Intern";"Mar 2015";"Aug 2015";"Assist in the software integration phase of UOB Mighty App.";"Singapore";"https://www.linkedin.com/company/6883";"6883";;;;;;;;;;;;;;;;;;;;;;;;;;;;;;;;;"Singapore Management University";"Bachelor of Business Administration - BBA";"Business, Management, Marketing, and Related Support Services";"";"2018";"2021";"";"Republic Polytechnic";"Business Applications";"Business Application";"Valedictorian";"2013";"2016";"";"Woodgrove Secondary School";"";"GCE O levels";"";"2008";"2012";"";"""Financial Planning : 2, Public Speaking : 2, Life & Health Insurance Licenses : 2, Financial Analysis : 2, Investments : 1, Portfolio Management : 0, JavaScript : 0, Microsoft Office : 0, Microsoft Excel : 0, Microsoft Word : 0, Leadership : 0, """;"";2;;"Insurance";5;"Asher Chua, Royce Lee";"Asher Chua";"Royce Lee";"Republic Polytechnic; Singapore Management University; AIA; AIA Singapore"
"janilyn-g-1b435b112";"Janilyn G.";;"https://www.linkedin.com/in/janilyn-g-1b435b112/";"Janilyn";"G.";"Financial Services Consultant at AIA Singapore Pte.Ltd";"https://media.licdn.com/dms/image/C5103AQHdfqiLec_IWg/profile-displayphoto-shrink_200_200/0?e=1576108800&v=beta&t=UVGTc_c7sqTkU43fDxMEglQRTjT3ETtbxyDslXB1myM";"Singapore";;;"Risk-based financial advisor offering a comprehensive and holistic financial guidance, by understanding and quantifying life's greatest risks.";;;;;;;;;;;;;;;;;"AIA Singapore Pte.Ltd";"Financial Services Consultant";;;"";"";"https://www.linkedin.com/search/results/index/?keywords=AIA%20Singapore%20Pte.Ltd";;;;"Manulife business processing services";"Associate";"Mar 2013";"Dec 2013";"";"";"https://www.linkedin.com/search/results/index/?keywords=Manulife%20business%20processing%20services";;;;;;;;;;;;;;;;;;;;;;;;;;;;;;;;;;;;;;;;;;;;;;;;;;;;;;"Ateneo School of Goverment";"Leadership and Social Entrepreneurship";"";"";"";"PRESENT";"";;;;;;;;;;;;;;;"""Risk Management : 14, Finance : 13, Investments : 12, Financial Services : 8, Portfolio Management : 7, Financial Advisory : 7, Sales : 6, Financial Planning : 6, Insurance : 5, Wealth Management : 4, Consulting : 4, """;"";2;;"Financial Services";15;"LAY Njin Djoen, Isaac Teo";"Lay Djoen";"Isaac Teo";"AIA; Toastmasters International; PESOS AND SENSE"
"lester-young-825075170";"Lester Young";;"https://www.linkedin.com/in/lester-young-825075170/";"Lester";"Young";"With all its sham, drudgery, and broken dreams, it is still a beautiful world. Be cheerful. Strive to be happy.";"https://media.licdn.com/dms/image/C5103AQH9SU4AK-zVug/profile-displayphoto-shrink_200_200/0?e=1576108800&v=beta&t=1qUjtQHyIxAhF-0_0esLFH9SvhZUOdniGNCqRyQ5q5o";"Singapore";;;"My goal is to help people with my consultation and advisory services for them to protect their loved ones, realise personal security and achieve financial freedom. I will analyse your financial information and show you how you can use your resources to its maximum potential to achieve the above.   You can put your mind at ease with me, as I firmly believe in a humble, honest and responsible approach, and will always use my best efforts to find the best solution for you, even if this means referring you elsewhere. For me, being trustworthy, accountable and reliable is more important than any short term gain.  I offer free personal consultations with no obligations, and I am contactable via telephone or social media.";;;;;;;;;;;;;;;;;"AIA";"Financial Service Consultant";"Dec 2018";"PRESENT";"Providing Financial advice and recommendations based on the client's financial and protection needs. Certified for: Financial Health Review and Advice Life Insurance Investment-Linked Products Accident & Health Plans";"Singapore";"https://www.linkedin.com/company/406952";"406952";;;;;;;;;;;;;;;;;;;;;;;;;;;;;;;;;;;;;;;;;;;;;;;;;;;;;;;;;;;;;;;"RMIT University";"Bachelor of Business (Accountancy)";"Accounting";"";"2016";"2018";"";"Singapore Polytechnic";"";"Information Technology";"";"2010";"2013";"";"Anglo-Chinese School (Barker Road)";"";"“O” levels";"";"2005";"2008";"";"""Financial Advisory : 5, Financial Planning : 6, Financial Analysis : 5, Financial Accounting : 3, Web Services : 2, Web Development : 1, Web Design : 2, Programming : 0, Financial Reporting : 2, Business Development : 2, Business Strategy : 2, International Financial Reporting Standards (IFRS)                                International Financial Reporting Standards (IFRS) : 2, Adobe Photoshop : 0, JavaScript : 0, Python : 0, Microsoft Outlook : 1, Microsoft SQL Server : 0, Microsoft Word : 1, Microsoft Office : 2, Microsoft Excel : 1, Microsoft PowerPoint : 1, """;"";2;;"Financial Services";6;"Yann Lee, Derrick Lee";"Yann Lee";"Derrick Lee";"AIA; LinkedIn; Google; Singapore Polytechnic; DBS Bank; RMIT University"
"tze-hern-yeo-0177a1138";"Tze Hern Yeo";;"https://www.linkedin.com/in/tze-hern-yeo-0177a1138/";"Tze";"Yeo";"Financial Service Consultant | NUS BBA Year 3";"data:image/gif;base64,R0lGODlhAQABAIAAAAAAAP///yH5BAEAAAAALAAAAAABAAEAAAIBRAA7";"Singapore";;;"Year 3 BBA student at NUS Business School, one of the leading Business School in Asia. Currently pursuing double major in Business (Finance) and Statistics.  Strong interest in volunteerism and sports (especially racket sports). Always open to new challenges and opportunities!";;;;;;;;;;;;;;;;;"AIA";"Financial Service Consultant";"Nov 2018";"PRESENT";"• Providing financial advisory services to clients in terms of risk management and wealth accumulation techniques. • AFP certified by FPAS in July 2019.  SP-ARES-ODYSSEY @odysseyadvisory";"AIA Alexandra";"https://www.linkedin.com/company/406952";"406952";;;"NUS Students'​ Business Club (Bizad Club)";"Project Director for O'Week";"Sep 2017";"Aug 2018";"• Spearheaded one of the largest freshmen orientation camp in NUS with a total of 850 participants. • Coordinated between the three cells in the committee (Events, External, Human Resource) and liaised with external stakeholders such as Sentosa and Zouk for event venues.";"NUS Business School";"https://www.linkedin.com/company/13659223";"13659223";;;"Singapore Army";"DYS2, 5th Battalion Singapore Infantry Regiment";"Feb 2017";"Jun 2017";"As the Deputy Intelligence Office (DYS2), I served to help in the analysis of terrain and possibilities. I also spearheaded a Security Team where I worked with all the Company Orderly Sergeant (COS)/Armskote IC and ensured that there were no security breaches.";"North West, Singapore";"https://www.linkedin.com/company/3167420";"3167420";;;"Ministry of Education, Singapore (MOE)";"Teaching Intern";"Jan 2015";"Mar 2015";"Prior to teaching at Anderson Secondary School, I received training at MOE HQ on delivering lesson plans and ways of teaching.  Soon after, I embarked on my teaching stint at Anderson Secondary School from 12 Jan";"Anderson Secondary School";"https://www.linkedin.com/company/547288";"547288";;;;;;;;;;;;;;;;;;;;;;;;;;;;;;;;;"NUS Business School";"Bachelor of Business Administration - BBA";"Finance";"";"2017";"2021";"• Project Director, Business O'Week 2018• Financial Secretary 2IC & Logistics Secretary, CAPT House Committee• Vice-Director (Training and Development), CAPT Ambassador• Publicity Sub-Committee, CAPT CAPTISS• Spring Student Exchange Programme (SEP) at HEC Paris (Feb’19 - May’19)";"HEC Paris";"Student Exchange Programme (SEP), Spring Semester, Business Administration (Finance Specialisation)";"Finance";"";"2019";"2019";"Modules taken:1. Corporate Finance2. Merger & Acquisition3. Credit Rating4. Strategy5. Operations & Supply Chain Management6. Macroeconomics7. French";"Nanyang Junior College";"GCE 'A'​ Level";"Science";"";"2013";"2014";"1) Leadership - Class Chairman (2013-2014) - Secretary, Scholars'​ Development Programme (2013-2014) - Treasurer, Tennis (2013-2014) - NY Ambassador  (2013-2014)2) Achievements- National Youth Achievement Award, Silver (2013-2014) - CCA Award (Individual) (2014)- Distinction in Australian Mathematics Competition (2013) - Overall IC for Service-Learning Project 2014 (2014)- Academic Excellence Award for A Level (2014)- Edusave Character Award (2013)- Edusave Merit Bursary (2013)- Edusave Award for Achievement, Good Leadership and Service (2014)- Edusave Merit Bursary (2014)";"""Microsoft Office : 0, Management : 0, Leadership : 0, Project Management : 0, Microsoft Excel : 0, Microsoft Word : 0, Microsoft PowerPoint : 0, Team Leadership : 0, """;"";2;;"Financial Services";13;"Jason Tang, LAY Njin Djoen";"Jason Tang";"Lay Djoen";"AIA; NUS Students'​ Business Club (Bizad Club); SAF; Singapore Army; NUS Business School; HEC Paris"
"tanhuimin";"Tan Huimin";;"https://www.linkedin.com/in/tanhuimin/";"Tan";"Huimin";"Helping you make meaningful decisions to live life on your own terms | Financial Planning|Retirement|Employee Benefits";"https://media.licdn.com/dms/image/C5103AQGrnFr82L0dTA/profile-displayphoto-shrink_200_200/0?e=1576108800&v=beta&t=lBlgFusgk2mDcpX_sz5koFOylIVCOatb86FEeHT8x5Y";"Singapore";;;"I am a financial advisor focused on financial planning for working professionals and business owners. In my daily conversations over coffee and meals, i often hear about the frustrations, challenges and complexities that you face on the many financial products available in the market and it is only natural if you fall into the trap of paralysis analysis.  Because, you want the best for yourself and your loved ones.  What is the best?  Over the years, i learned and found that successful financial planning is simplifying the process, knowing your outcomes and taking action. In the process, i want to help you answer 3 universal questions.  1. What if you live too long? 2. What if you are gone too soon? 3. What if you cannot work due to a major injury or traumatic illness?  Having a process provides clarity and certainty knowing that you will achieve your outcomes. I am committed to help you make meaningful decisions to live life on your own terms financially.  Living is not only about working. Sports and traveling are ways for me to balance my life. Staying active is key to maintaining vitality and a high energy level, while visiting different countries is an opportunity to see the world differently and appreciate what we have. It is an invaluable life experience.  My direction into leadership and volunteering is exciting as i am able to give back through mentoring and coaching. The financial services industry has seen its fair share of talent leak and mis-matchers. I hope to give people who are considering a professional sales career a picture of the industry's good, bad and the ugly. If the fit is right, the work we do, besides being meaningful, will bring freedom of personal development and income longevity.  Summary of skillsets - Financial Planning - Retirement - Employee Benefits - Wealth Accumulation - Estate Planning  CONNECT WITH ME LinkedIn: www.linkedin.com/in/tanhuimin Email: huimin.tan@aia.com.sg";;;;;;;;;;;;;;;;;"AIA";"Financial Services Manager, AFPCM, AEPP";"Nov 2010";"PRESENT";"";"Singapore";"https://www.linkedin.com/company/406952";"406952";;;"Lee Wenyong & Co. Holdings Pte Ltd";"Marketing Director";"2013";"PRESENT";"";"Singapore";"https://www.linkedin.com/search/results/index/?keywords=Lee%20Wenyong%20%26%20Co.%20Holdings%20Pte%20Ltd";;;;"Accenture";"Analyst Programmer";"Jun 2006";"Jun 2010";"";"";"https://www.linkedin.com/search/results/index/?keywords=Accenture";;;;;;;;;;;;;;;;;;;;;;;;;;;;;;;;;;;;;;;;;;;;"National University of Singapore";"Bachelor of Engineering";"Computer Engineering";"";"2002";"2006";"";"Victoria Junior College";"";"";"";"1998";"1999";"";"Maris Stella High School";"";"";"";"1994";"1997";"";"""Business Analysis : 13, Risk Management : 13, Vendor Management : 6, Project Planning : 4, Strategy : 4, Retirement Planning : 2, Business Planning : 2, Employee Benefits : 1, Business Strategy : 1, Oracle : 3, Team Building : 4, Leadership : 1, Personal Financial Planning : 2, """;"";2;;"Financial Services";3;"Lawrence Chua, Evan Lim";"Lawrence Chua";"Evan Lim";"Brené Brown; Tony Robbins; Medix Global; Life Happens; Simon Sinek; Ray Dalio"
"norman-w-b25296152";"Norman W.";;"https://www.linkedin.com/in/norman-w-b25296152/";"Norman";"W.";"Undergraduate at Nanyang Technological University & Financial Advisor for Life Insurance";"https://media.licdn.com/dms/image/C5103AQGCBG1JM_kbog/profile-displayphoto-shrink_200_200/0?e=1576108800&v=beta&t=iCnCzXbAo6MpklrI2aw8yf7YITI6PCwXBBZXQ6PM95c";"Singapore";;;"Norman is currently an undergraduate in Nanyang Technological University, pursuing Bachelor of Accountancy.  Keeping up with technological advancement and knowing the importance of programming, Norman took up an the elective on Programming and Data Analytics. This allows him to get a hand in the software, Python, learning the basic fundamental of coding and generate informative useful insights via Tableau. It is one of the essential skills set required as we move towards using paperless records.   Technological advancement and “soft” crime are directly related. This requires organisations to ensure proper internal controls set, or it will risk facing possibility of fraud and lose millions or even billions of dollars. Preventive measure and early detection is key to reduce the loss, and that is also what currently Norman is learning in Forensic Accounting and Fraud Investigation.  Norman graduated from Ngee Ann Polytechnic with Diploma with Merit in Accountancy & Diploma Plus in Quantitative Methods & Economics. During his course of studies in Ngee Ann Polytechnic, Norman had gained valuable 6-month internship experience with RSM Chio Lim LLP as an Audit Assistant. With his vast knowledge in auditing, he hopes to help firms to discover and improve the any company's account state.  Norman also obtained Cert SCI (Life Insurance) and Cert SCI (Health Insurance) in 2017. Moving out of his comfort zone, he joined AIA Singapore as Financial Service Consultant. He has helped individuals to discover any financial risk and provides customized solutions. This has trained his communication skills and him to be forward-looking.   Accounting has always been Norman's passion since Secondary School. Applying his technical accounting knowledge at work will be a dream come true for him. He aims to be an Associate Member of Singapore Chartered Accountant.";;;;;;;;;;;;;;;;;"AIA";"Financial Service Consultant";"Aug 2017";"PRESENT";"- Analyse customer financial health and provides customized solution for their financial risk - Facilitate claims on behalf of insured, allowing them to have a peace of mind in recovery";"";"https://www.linkedin.com/company/406952";"406952";;;"Future Electronics";"Accounts Payable Assistant (Trainee)";"May 2019";"Jul 2019";"- Created a standardised internal process, to facilitate the prompt payment and reduce man hour time by 50% - Ensures prompt recording of expenses to support month-end budgeting and reconciliation";"Singapore";"https://www.linkedin.com/company/157320";"157320";;;"RSM Chio Lim LLP";"Audit Assistant";"Sep 2014";"Mar 2015";"- Conducted audit check for more than 20 entities ranging from listed companies to small and medium-sized enterprises - Vouched ledgers figures to source documents, ensuring accuracy of trial balance - Prepared Financial Statements for entities and ensures that it accords to Financial Rep";"";"https://www.linkedin.com/search/results/index/?keywords=RSM%20Chio%20Lim%20LLP";;;;;;;;;;;;;;;;;;;;;;;;;;;;;;;;;;;;;;;;;;;;"Nanyang Technological University";"Bachelor's degree";"Accounting";"Honours (Distinction)";"";"PRESENT";"";"Ngee Ann Polytechnic";"Diplomas with Merit";"Accounting";"";"";"PRESENT";"Additional Certificate: Diploma Plus in Quantitative Methods & Economics";;;;;;;;"""Financial Planning : 1, Financial Advisory : 1, Accounting : 1, Life Insurance : 0, Investments : 0, Retirement Planning : 0, """;"";2;;"Financial Services";5;"Ang Cheng Feng Daryl, Tiffany Yung PMP,CISA,ITIL v3,MSC,MA,GCIP,PGMgt,BBA";"Ang Feng Daryl";"Tiffany Yung";"Nanyang Technological University; Ngee Ann Polytechnic; AIA; KPMG US; KPMG Singapore; Deloitte"
"sherontan";"Sheron Tan";;"https://www.linkedin.com/in/sherontan/";"Sheron";"Tan";"Personal Wealth Manager at AIA";"https://media.licdn.com/dms/image/C5103AQG6M2Gf4Zsbyw/profile-displayphoto-shrink_200_200/0?e=1576108800&v=beta&t=FoGtVA-Czg-_gyDdmRucTTg9IWURunRJYoldXx3Zi9w";"Singapore";;"October 16";"Sheron is managing a group of young professional and vibrant financial advisors representing AIA Singapore. Specialized in helping clients with wealth accumulation and wealth preservation, including but not limited to legacy planning, retirement planning, insurance planning and Will & Trust Planning.   “Don't ever let someone tell you, you can't do something. Not even me. You got a dream, you got to protect it” She lives by this quote and has achieved her prestigious MDRT award at a young age of 26.   Now, she is actively looking for new talents with high level of desire for success to join her team. Clients’ interest is always our first priority. Build your own dream TODAY!";;;;;;;;;;;;;;;;;"AIA";"Personal Wealth Manager";"Jun 2018";"PRESENT";"Managing Client's wealth accumulation and wealth preservation portfolio";"Singapore";"https://www.linkedin.com/company/406952";"406952";;;"AIA";"Financial Services Consultant";"Nov 2012";"PRESENT";"If life cover was FREE, how much would you want to take?  Share with me via personal message, I would love to find out from you.";"Singapore";"https://www.linkedin.com/company/406952";"406952";;;"Chan Brothers Travel Pte Ltd";"Travel industry";"Sep 2010";"Jul 2012";"Travelling is my passion. I love the endless water seen from the sandy beach, the diversity of the different cultures, the cooling weather of Winter. Meeting new friends along the journey,connecting with them and understanding them has enrich my life and boost my knowledge of the world in a way that books cannot deliver.";"Singapore";"https://www.linkedin.com/company/2787500";"2787500";;;;;;;;;;;;;;;;;;;;;;;;;;;;;;;;;;;;;;;;;;;"University of Nevada-Las Vegas , Singapore Campus";"Bachelor of Hospitality Management";"Hospitality Administration/Management";"";"2012";"2014";"Graduated from UNLV Singapore, I am equipped with both the management theories and operational competencies necessary for this wonderful industry. I took classes specific to the industry including an Introduction to Hospitality, Human Resources Management, Organizational Behavior, Facilities Management, Hospitality Law, Leadership, Management and Ethics. I also study Food Sanitation, Food Service Operations, Cost Control, Career Development, Financial and Managerial Accounting, Financial Management, Hospitality Service Management, and Operations and Strategic Management.""Great services comes from the heart"" - a motto which I strongly believes in. To excel in this industry, it is not just about the knowledge nor the experience, it's about the attitude. Having the right attitude to work, to serve, to bring a smile to the customer's face.";;;;;;;;;;;;;;;"""Insurance : 21, Investments : 14, Financial Services : 11, Business Development : 8, Marketing Strategy : 3, Financial Advisory : 3, Strategic Financial Planning : 2, Finance : 2, Business Strategy : 2, Sales : 1, Microsoft Word : 1, PowerPoint : 2, Microsoft Office : 11, Customer Service : 15, Management : 6, Leadership : 4, """;"1435";2;;"Financial Services";19;"Chua Inn Chong - E-Commerce Strategist, Dave Loh AFP,AEPP,IBFQ,IDA";"Chua Chong - E-Commerce Strategist";"Dave Loh";"Banyan Tree Hotels & Resorts; Arianna Huffington; The Economist; University of Nevada-Las Vegas; Bill Gates; Financial Modeling: Financial Models, Investment Banking Modeling, Private Equity & VC Analytics"
